{
  "schemaVersion": "0.1",
  "experimentId": "EXP-0001",
  "experimentVersion": "1.0.0",
  "experimentDefinition": { "id": "EXPERIMENT-DEFINITION", "locator": "experiments/EXP-0001/experiment.json", "checksum": { "algorithm": "SHA-256", "value": "1111111111111111111111111111111111111111111111111111111111111111" } },
  "executionId": "EXEC-20260719-0002",
  "resultVersion": "1.0.0",
  "status": "COMPLETED",
  "implementation": { "repositoryCommit": "1111111111111111111111111111111111111111", "repositoryBranch": "feature/qaip-0.7-ep-0001", "workingTreeState": "DIRTY", "dirtyDetails": "Only an untracked diagnostic log existed; its checksum is retained.", "release": "QAIP 0.6 RC1", "modelVersions": { "qaModelSchema": "0.1", "experimentSchema": "0.1" } },
  "startedAt": "2026-07-19T15:00:00+03:00",
  "finishedAt": "2026-07-19T15:04:00+03:00",
  "environment": { "operatingSystem": { "name": "Windows", "version": "11" }, "architecture": "x86_64", "java": { "name": "Eclipse Temurin", "version": "21.0.7" }, "locale": "en-US / UTF-8", "timezone": "Europe/Moscow", "dependencies": [{ "name": "Gradle Wrapper", "version": "8.14.3" }] },
  "dataset": { "datasetId": "QAIP-DETERMINISM-CALIBRATION", "version": "1.0.0", "locator": "experiments/EXP-0001/dataset.md", "integrityReference": { "id": "DATASET-MANIFEST", "locator": "experiments/EXP-0001/inputs/SHA256SUMS", "checksum": { "algorithm": "SHA-256", "value": "3333333333333333333333333333333333333333333333333333333333333333" } } },
  "protocol": { "version": "1.0.0", "locator": "experiments/EXP-0001/protocol.md", "checksum": { "algorithm": "SHA-256", "value": "2222222222222222222222222222222222222222222222222222222222222222" } },
  "actualParameters": { "command": ".\\gradlew.bat :qaip-analysis:test --tests *IllustrativeExperiment*", "workingDirectory": "repository root", "configuration": { "canonicalization": "ordered JSON fields" }, "seeds": [], "repetitions": 10, "timeout": "Five minutes per repetition", "retryBehavior": "Execution stopped after an infrastructure failure", "externalServices": [] },
  "rawArtifacts": [{ "id": "RAW-PARTIAL", "kind": "partial outputs and logs", "locator": "artifact:EXEC-20260719-0002/raw/partial", "checksum": { "algorithm": "SHA-256", "value": "6666666666666666666666666666666666666666666666666666666666666666" }, "retention": "One year", "access": "Project artifact-store readers" }],
  "observations": [{ "id": "OBS-PARTIAL", "description": "Only four of ten illustrative repetitions produced complete outputs before failure.", "value": 4, "artifactRefs": ["RAW-PARTIAL"] }],
  "metrics": [{ "metricId": "METRIC-VALID-RUNS", "definitionOrFormula": "count(runs with exit code 0 and complete output)", "value": 4, "unit": "count", "tolerance": "exact", "evidenceRefs": ["RAW-PARTIAL", "OBS-PARTIAL"] }],
  "deviations": [],
  "failures": [{ "id": "FAILURE-01", "description": "Illustrative worker termination prevented remaining repetitions.", "affectedRuns": ["EXEC-20260719-0002"], "artifactRefs": ["RAW-PARTIAL"], "handling": "Stopped execution and retained partial evidence without replacement." }],
  "anomalies": [{ "id": "ANOMALY-01", "description": "Working tree was dirty at execution time.", "affectedRuns": ["EXEC-20260719-0002"], "artifactRefs": ["RAW-PARTIAL"], "handling": "Recorded explicitly as a possible validity threat." }],
  "criteriaEvaluation": [
    { "criterionId": "CRIT-001", "evidenceRefs": ["RAW-PARTIAL"], "met": null, "rationale": "The required ten outputs are unavailable." },
    { "criterionId": "CRIT-002", "evidenceRefs": ["RAW-PARTIAL"], "met": null, "rationale": "The partial sample cannot resolve the frozen comparison." },
    { "criterionId": "CRIT-003", "evidenceRefs": ["RAW-PARTIAL", "OBS-PARTIAL"], "met": true, "rationale": "Fewer than ten valid outputs are available." }
  ],
  "outcome": "INCONCLUSIVE",
  "conclusion": "The illustrative partial evidence cannot support or not support the frozen hypothesis.",
  "interpretationLimits": "This is schema calibration data, not an actual execution; missing repetitions and dirty state prevent inference.",
  "observedThreats": [{ "id": "THREAT-EXECUTION", "description": "Partial execution and dirty repository state may affect results.", "evidenceRefs": ["RAW-PARTIAL", "OBS-PARTIAL"], "effectOnConclusion": "The outcome remains inconclusive.", "followUp": "Use a clean checkout and repeat under the frozen protocol." }],
  "reviewer": { "reviewer": { "displayName": "QAIP result reviewer", "role": "Result reviewer" }, "decidedAt": "2026-07-19T16:00:00+03:00", "decision": "ACCEPTED", "rationale": "The example correctly retains failed-run evidence and makes no resolved claim." },
  "repeatability": { "status": "BLOCKED", "replicationRefs": [] },
  "corrections": []
}
